call mtr.add_suppression("\\[TIDESDB\\].*TDB_ERR_CONFLICT");
#
# Issue #77: Concurrent conflict detection
#
CREATE TABLE t (
i INT NOT NULL PRIMARY KEY,
x INT
) ENGINE=TidesDB;
INSERT INTO t VALUES (1,10),(2,20),(3,30),(4,40),(5,50);
# =+=+= TEST 1: Two UPDATEs on same row =+=+=
START TRANSACTION;
UPDATE t SET x = 999 WHERE i = 1;
START TRANSACTION;
UPDATE t SET x = 888 WHERE i = 1;
COMMIT;
COMMIT;
Got one of the listed errors
# con2 wins: x should be 888
SELECT * FROM t WHERE i = 1;
i	x
1	888
# =+=+= TEST 2: UPDATE vs DELETE on same row =+=+=
START TRANSACTION;
UPDATE t SET x = 777 WHERE i = 2;
START TRANSACTION;
DELETE FROM t WHERE i = 2;
COMMIT;
COMMIT;
Got one of the listed errors
# con2 wins: row 2 should be gone
SELECT * FROM t WHERE i = 2;
i	x
# Remaining rows intact
SELECT * FROM t ORDER BY i;
i	x
1	888
3	30
4	40
5	50
# Cleanup
DROP TABLE t;
#
# Done.
