#
# Setup
#
CREATE TABLE docs (
id    INT NOT NULL PRIMARY KEY,
title VARCHAR(100),
v     VECTOR(4) NOT NULL,
KEY title_idx (title)
) ENGINE=TidesDB;
INSERT INTO docs VALUES (1, 'origin-x', STRING_TO_VECTOR('[1.0, 0.0, 0.0, 0.0]'));
INSERT INTO docs VALUES (2, 'origin-y', STRING_TO_VECTOR('[0.0, 1.0, 0.0, 0.0]'));
INSERT INTO docs VALUES (3, 'origin-z', STRING_TO_VECTOR('[0.0, 0.0, 1.0, 0.4]'));
INSERT INTO docs VALUES (4, 'near-x',   STRING_TO_VECTOR('[0.9, 0.1, 0.0, 0.0]'));
INSERT INTO docs VALUES (5, 'center',   STRING_TO_VECTOR('[0.5, 0.5, 0.5, 0.5]'));
#
# TEST 1: every vector reads back as it was written
#
SELECT id, title, VECTOR_TO_STRING(v) AS v FROM docs ORDER BY id;
id	title	v
1	origin-x	[1.00000e+00,0.00000e+00,0.00000e+00,0.00000e+00]
2	origin-y	[0.00000e+00,1.00000e+00,0.00000e+00,0.00000e+00]
3	origin-z	[0.00000e+00,0.00000e+00,1.00000e+00,4.00000e-01]
4	near-x	[9.00000e-01,1.00000e-01,0.00000e+00,0.00000e+00]
5	center	[5.00000e-01,5.00000e-01,5.00000e-01,5.00000e-01]
SELECT id, VECTOR_DIM(v) AS dims FROM docs ORDER BY id;
id	dims
1	4
2	4
3	4
4	4
5	4
#
# TEST 2: a vector reached through a secondary index on another column
#
SELECT id, VECTOR_TO_STRING(v) AS v FROM docs WHERE title = 'near-x';
id	v
4	[9.00000e-01,1.00000e-01,0.00000e+00,0.00000e+00]
#
# TEST 3: UPDATE the vector column
#
UPDATE docs SET v = STRING_TO_VECTOR('[0.0, 0.0, 0.0, 1.0]') WHERE id = 5;
SELECT id, title, VECTOR_TO_STRING(v) AS v FROM docs WHERE id = 5;
id	title	v
5	center	[0.00000e+00,0.00000e+00,0.00000e+00,1.00000e+00]
#
# TEST 4: UPDATE a non-vector column leaves the vector alone
#
UPDATE docs SET title = 'renamed' WHERE id = 4;
SELECT id, title, VECTOR_TO_STRING(v) AS v FROM docs WHERE id = 4;
id	title	v
4	renamed	[9.00000e-01,1.00000e-01,0.00000e+00,0.00000e+00]
#
# TEST 5: DELETE a row with a vector
#
DELETE FROM docs WHERE id = 2;
SELECT id, title, VECTOR_TO_STRING(v) AS v FROM docs ORDER BY id;
id	title	v
1	origin-x	[1.00000e+00,0.00000e+00,0.00000e+00,0.00000e+00]
3	origin-z	[0.00000e+00,0.00000e+00,1.00000e+00,4.00000e-01]
4	renamed	[9.00000e-01,1.00000e-01,0.00000e+00,0.00000e+00]
5	center	[0.00000e+00,0.00000e+00,0.00000e+00,1.00000e+00]
#
# TEST 6: the vectors survive a restart
#
# restart
SELECT id, title, VECTOR_TO_STRING(v) AS v FROM docs ORDER BY id;
id	title	v
1	origin-x	[1.00000e+00,0.00000e+00,0.00000e+00,0.00000e+00]
3	origin-z	[0.00000e+00,0.00000e+00,1.00000e+00,4.00000e-01]
4	renamed	[9.00000e-01,1.00000e-01,0.00000e+00,0.00000e+00]
5	center	[0.00000e+00,0.00000e+00,0.00000e+00,1.00000e+00]
#
# TEST 7: a vector that does not match the column's dimension is refused
#
INSERT INTO docs VALUES (6, 'too-wide', STRING_TO_VECTOR('[1.0, 2.0, 3.0, 4.0, 5.0]'));
ERROR 22001: Data too long for column 'v' at row 1
DROP TABLE docs;
#
# There is no similarity search, and no way to index a vector
#
# Indexing is the half that can be pinned by behaviour rather than by name:
# a vector is not a scalar the server can order, so every spelling of an
# index over one is refused.  If that ever stops being true, this fails and
# the vector-columns chapter needs revisiting.
CREATE TABLE vidx (id INT PRIMARY KEY, v VECTOR(4) NOT NULL, VECTOR INDEX (v)) ENGINE=TidesDB;
ERROR 42000: You have an error in your SQL syntax; check the manual that corresponds to your MySQL server version for the right syntax to use near 'INDEX (v)) ENGINE=TidesDB' at line 1
CREATE TABLE vidx (id INT PRIMARY KEY, v VECTOR(4) NOT NULL, KEY (v)) ENGINE=TidesDB;
ERROR HY000: Non-scalar (e.g., vector) column 'v' cannot be used as key.
CREATE TABLE vidx (id INT PRIMARY KEY, v VECTOR(4) NOT NULL, FULLTEXT KEY (v)) ENGINE=TidesDB;
ERROR HY000: Non-scalar (e.g., vector) column 'v' cannot be used as key.
CREATE TABLE vidx (id INT PRIMARY KEY, v VECTOR(4) NOT NULL, SPATIAL KEY (v)) ENGINE=TidesDB;
ERROR HY000: Non-scalar (e.g., vector) column 'v' cannot be used as key.
# The distance-function half cannot be canaried the same way: there is no
# name to probe for that the server has committed to, so its absence is
# recorded in the chapter rather than asserted here.
# Done.
